author,id,selftext,subreddit,title
Rocklobster92,cae98m,"This show is annoying me. They aren’t really spinning the wheel, and I don’t see any way they can stop the wheel manually so how is this not rigged?  What decides when the wheel stops?  I know there is some stupid ball that comes out, but we all know it will end up along the bottom of the wheel because gravity. So what gives?",NoStupidQuestions,"In the game show Spin the Wheel, what decided when the wheel stops?"
Drieza,c8zsx1,,NoStupidQuestions,Does anyone want to create a gamer pride month¿
VaultDweller112,c8gkpp,,NoStupidQuestions,Why my dick smell like pool water?
Maaother227,c9g24e,,NoStupidQuestions,Why does the Democratic Party claim to be the party for the Working class but like high taxes that the middle class can’t afford
BenedictThunderfuck,c9dxul,"I've always noticed it, but never really pointed it out due to not wanting to sound creepy or weird. Is it related to the same gene that births them that way, like, makes men have hippo hips like well gifted women? Does it have anything to do with the chromosome?",NoStupidQuestions,Why do people with down syndrome have such big fat butts?
willjackowski,ca0owf,"if a president completes his third term and proceeds to run as a write in, and wins, what happens?

(i know this will never happen, but what if)

EDIT: I MEANT COMPLETES A SECOND TERM NOT THIRD",NoStupidQuestions,possible 3rd presidential term??
ImRikkyBobby,c8u7cs,"Any opinion on that sub that is an actual unpopular opinion which you know will trigger people are down voted to shit. I thought that was a place for like minded people who agree on opinions that the majority of society deem... unpopular.

To test this theory I made a post saying that (unpopular opinion) we should be allowed to own slaves. Now obviously, as far as opinions goes this one is VERY unpopular and I was attacked almost immediately. lol

Granted, I was not being serious, I wanted to test my theory on unpopular opinions. 

&amp;#x200B;

lol",NoStupidQuestions,Why are the REAL unpopular opinions on r/unpopularopinions always down voted to shit?
YourOwnBiggestFan,c8nbvn,,NoStupidQuestions,"If you peed over a border, would it be considered exporting your urine?"
CarnivorousL,c80wjt,"I know how bigoted that sounds. I know it is a gross misunderstanding of transexuality.

But I really want an answer so I cam be in total, 100%, solidarity. I like the trans community. They are extremely friendly and fun to talk to. Contrapoints is one of the smartest YouTubers I follow.

But I just need am answer to that question because I feel like I missed the answer somewhere. If a 5""2 Chinese woman thinks they are, say, a 6""3 American male, how is that different from the dysphoria a trans person suffers from?

Please answer me honestly, I know this sounds REALLY bad.",NoStupidQuestions,Why is being trans okay but thinking you're black when you're white isn't?
littlekenji83,c9zv2y,As in like they won’t act upon their thoughts but they just “have them”.,NoStupidQuestions,Why are all pedophiles labeled as monsters when they aren’t all monsters?
[deleted],c9cbj5,,NoStupidQuestions,"Is it weird that on the 4th of July at night, I like to get very high and sit in a field by myself and close my eyes and listen to the fireworks in the city and pretend I'm on the outskirts of a WW1 battle?"
mxi_steel,ca5n6k,,NoStupidQuestions,anyone else notice that roblox based video game youtbers get more popular if they are north american or austeralin. with minecraft based video game youtubers being english? why is that?
bumasslacefront,ca4chy,"I’m watching old episode of Kitchen Nightmares, Gordon Ramsey’s old show, and every time he’s meeting people for the first time he greets them and says “Nice to see you” instead of “Nice to meet you”. Is this a British thing just a Gordon Ramsey thing?",NoStupidQuestions,Gordon Ramsey
AdditionalForm2,c9wlwq,,NoStupidQuestions,Why do 3% of the population commit 50% of murders?
Computerized_God,c9rwab,"Or any other variation of accusing someone with the breaking of their nose.

Is it a thing in cinematography?

&amp;#x200B;

Cheers.",NoStupidQuestions,"Why in movies and films it is very common for people to say ""I think you've broken my nose"""
UltraviolentJt,c9jogv,"because I feel like I read pretty fast, but sometimes it’s like 3 seconds. and today I really wanted those vibes 2day.",NoStupidQuestions,"In a post that says “like in x seconds for good luck”, when does the countdown begin?"
Af203,c9e9c7,"* Unlike Facebook, you can't use it for communications and groups
* Unlike Reddit and Twitter, you can't use it for breaking news and broadcasting your opinions
* Unlike LinkedIn, you can't use it to display work-related details
* Unlike Reddit and Quora, you can't use it for questions and answers",NoStupidQuestions,Why is Instagram so popular?
guacmaster98,c8zglx,"For example: would a person be bisexual if they were just attracted to cis women and trans women? Or cis men and nonbinary people? Or does ""sexual"" imply that it only describes being attracted to two types of biological sexes, rather than two genders in general?

And for the record I am making the assumption that a bisexual can only be attracted to two types of people; otherwise they would be polysexual or pansexual.",NoStupidQuestions,"If a person is bisexual, do they have to just be attracted to cis men and cis women, or can it be some other combination of things?"
GimmeHotWingsPlease,c8u3pt,,NoStupidQuestions,"If a major terrorist attack (9/11 scale of larger) happened on December 25th, would the US change the legal date of Christmas?"
jkk45,c8pq72,"As above. I know men tend to be attracted to women/girls who resemble their mothers.

Is it the same for the other round: I.E: female attraction to men?",NoStupidQuestions,Are females attracted to men/boys who look like their dads
Tottalynotdeadinside,c8lv34,,NoStupidQuestions,Why do mods delete the funny replies?
TopCommentINC,c8ju1i,"I’m a girl(no homo 😂) and I’m proud of my beauty. It really bugs me when girls call themselves ugly.

*girls (title)",NoStupidQuestions,Why do cute girl say they aren’t cute?
SETTLEDOWNSIR,c8jg1z,"There's a lot of talk about separating families and everything but are the kids allowed to go back to Mexico with their parents? Because if they are, why don't they just do that?



The conditions in these facilities is probably so much worse than just going to Mexico.",NoStupidQuestions,Can the children being held at the immigration camps go to Mexico with their parents?
SirMoeMan,c8f45p,"Like, some crosses have Jesus on them and it would work anyways.  If I had a cross with someone else like Kermit instead would it be just as effective?",NoStupidQuestions,"For keeping demons back, would holding a cross to them that had any figure crucified on it work?"
StroubFTW,c89g5o,"I always see memes on some subreddits saying Fortnite bad and stuff like that, but I honestly cannot understand why it's getting so much hate? I'm no fan of the game myself, but I don't HATE it and found it fun on the first couple times I played it...",NoStupidQuestions,Why is Fortnite getting so much hate?
nairshark,c82bne,"I’ve been using reddit for a while now and just realized that everyone has to have a unique name, so is this username ok for multiple people to have? Are there other exceptions like it?",NoStupidQuestions,Why are there so many accounts named deleted?
HackedCarmel,c9iz30,"I’m really not trying to offend anyone. I’m bisexual, I like dicks and I also like pussys, but I would never dream of wearing a purple flag to tell the world how proud i am of the fact that i like dick and pussy. Also, stores decorating for pride month seems dumb to me, do I get a bisexual discount? No we just accept you for your queerness. Am i the odd one out here?

EDIT:Grammar",NoStupidQuestions,Am I the only LBGT person who rejects the whole “pride” aspect
confusedeuropean6,c8qevc,"If the problems in their countries are non existant in the detaining camps they can live through them and later apply for a legal stay in the US or go back. Why are people angry about people that are trying to enter the country illegaly getting detained?

It sounds like as if I was working very hard my entire life, got a nice house and my lazy neighbour was angry at me for not letting him live with me. If his house burned down I would let him build a tent in my yard for a limited time, but not give him a bedroom that I worked for.",NoStupidQuestions,Why are americans angry about illegal immigrants not getting through?
Plantpong,c8lkfq,They gave me a time frame and I am just sitting here contemplating all the things that can go wrong during delivery,NoStupidQuestions,Is it strange that I get anxious waiting for a delivery to arrive?
4momoka,c8hlgx,"i'm asking because he's whining but drags himself back but when I open the door but ok, I should just fucking use my strength and force him out with my leash, because it's not because i'm unable to walk with him during a thunderstorm, but because i clearly did not want to, yeah? thanks to the one person who actually answered my question.",NoStupidQuestions,Does my dog understand I can't walk with him because it's raining?
datfox_,c89hz8,"Edit: Cool, getting downvotes for being bisexual. 

I am a bisexual guy. I've been one for about two years.
My parents are those kind of people, who are badly against everything non heterosexual (parents are Russian btw, so that's even worse but we all live in Finland). In my family, we (they) don't like homo- and bisexuals especially. I currently have no plans telling them that I'm one, but I'll defenently do someday... I really have no idea where to even start. Maybe not tell them? Idk",NoStupidQuestions,How to tell my parents that I am bisexual?
DrFreezeGood01,c8ync4,"I have in a couple video game communities certain big name individuals having their reputation and career destroyed when it came out they were dating someone 10 years younger than themselves. Everyone in the community freaks out and calls it “f-ed up” or similar, and I just don’t understand it. My parents, and probably a lot of your parents are about 10 years about. I know my mother began dating my father before she turned 18. 

Why, if it is between two consenting mature individuals, is it such a crime for the older individual to be in a relationship with the younger one? 

Additionally, why do we punish (pseudo-)celebrities so much harder. Here these people in question lost their youtube career or professional gaming career because of this situation. Big name hollywood stars lose their jobs for a bad joke tweet. Why do we brush these things off if its our friends or some no-name, but a celebrity gets the shit as if they did something far more serious.",NoStupidQuestions,Can someone explain the stigma of dating someone younger than yourself (who is a minor)?
diiejso,c8ycjv,,NoStupidQuestions,Have you ever been eating popcorn at someone's house and wonder if their popcorn bowl is also their throw-up bowl?
GloomyMoon2,c9q3o6,,NoStupidQuestions,Can you feel an earthquake in a plane?
Neorio1,ca913g,,NoStupidQuestions,Can we blame the California earthquakes on climate change?
thegamingprophet31,ca6cc7,,NoStupidQuestions,Female human have period. Why don't female cats and dogs and other female mammals have period?
RememberTheSubHuman,ca128a,,NoStupidQuestions,Is it safe to receive cum in eye after LASIK surgery?
Optimal_Instruction,ca0vyl,"They either drop the u in words like Honour and Flavour, swtich the r and e around in Centre and spell Mum as Mom. Why?",NoStupidQuestions,"Why do Americans misspell words like Flavour, Honour, Centre, Mum, etc?"
RedditPunRater,c9tebn,"Assuming the same amount of calories are being consumed when intermittent fasting. 

High levels of insulin prevent fat from being broken down for energy. So your body composition (fat to muscle ratio) will often times be better when you intermittently fast instead of eating 5 small meals a day since your insulin won't constantly be spiking all throughout the day. Why is the 5 small meal thing been pushed so much whe it leads to obesity and ""skinny fat"" people? Fasting is also good when you have cancer since cancer cells survive off of carbohydrates and fasting is a way to temporarily starve them and slow cancer growth. 

It's just better all around, so why isn't it talked about more in nutritional education?",NoStupidQuestions,Why do so many people just assume (intermittent) fasting is bad and unhealthy for you when it's better than eating constantly throughout the day and raising your insulin levels constantly?
tyla-roo,c9px6l,,NoStupidQuestions,Is cereal a soup?
NazisAreCoolAF,c9pr8e,Is it ethically okay to like your own posts on various websites that allow it? Or is this morally unacceptable and punishable by death?,NoStupidQuestions,Is this even a morally okay thing to do?
PutridWind69,c9l6jx,"I don't know if moving to Europe would actually work, but I thought I'd ask anyway.

I'm currently in high school, and I want to be a doctor when I'm older. Honestly, I really don't know how to accomplish that.

I'm only fluent in English, but I'm learning Spanish. I'm willing to try learning another language if necessary, though.",NoStupidQuestions,I want to go to college in Europe to avoid American student debt. How can I do this and what country should I move to?
Skilllest,c9jmd0,"In the end the decision isn't at all tied to the popular vote, so what's the point?",NoStupidQuestions,What is the purpose of voting in the US presidential election?
Bullshitman101,c9idak,Why are judges always angry?,NoStupidQuestions,Judges..
sikkerhet,c9ggnm,"I agree that they shouldn't HAVE to move away and that the water should have been handled years before it became a public issue, but what are they still doing there at this point? It's been long enough that their kids have severe brain damage. People are infertile and sick and dying, and I'm 100% on the side of saying the problem should have been solved, but like... my parents moved across the country with three kids and no money. I moved across the country with less than 1k saved up.

I know I was a single young adult at the time and only responsible for myself, but if your options are ""go into debt/more debt moving to another city"" or ""my son will die of lead poisoning"" I don't really see any choice here.",NoStupidQuestions,"Why do people still live in Flint, MI?"
stiytyrt,c9c58n,,NoStupidQuestions,How can a person become straight from gay?
lattelin,c99z1h,"I feel like it would be ridiculous if Ariel is the only black member of the family. Makes sense they have black actors playing every member of the royal family. 


Sad to see another ginger character go.... :(",NoStupidQuestions,If Halle Bailey is playing Ariel. Does that mean King Triton and her 7 sisters are all going to be played by black actors?
JackCAVFC,c94pm8,"Like when your finished waiting for the waiter should you stack your plates so it’s easier to take away, as I always did this but a freind has claimed it’s rude and wanted to ask who’s correct",NoStupidQuestions,When your finished at a restaurant should you stack your plates when your finished to be polite.
RollingKaiten,c8tweh,I saw my coworkers MRI and was just amazed and when i asked her she said said she doesnt know then just asked me random question like who are you? Howd you get in here? I am calling the police. For real these pregnant women and their hormones.,NoStupidQuestions,"During pregnancy, does the baby face inwards like its head is towards the mother's spinal column. In most movies and documentaries i always see them facing the same way as their moms. Is there also a chance that they come out head first or their head is facing the leg?"
MicrowaveNugget,c8nyst,"Since atoms is like 90% nothing, shouldnt we be able to get the atoms in our body to go between the empty spaces of the other atoms?
 Like, if i shot a football (a round one stupid americans) suuuuuper fast into a wall, could it leave the concrete wall atoms intact and make the football go between the empty spaces?

I have been thinking about this for so long, and i cant find an answer. It makes sense, but it doesnt because we cant.",NoStupidQuestions,Can we go through walls?
Ferdinandofthedogs,c8m5e1,,NoStupidQuestions,Were credit cards shaped like that to fit wallets or the other way around?
ModmanX,c8hpop,"i know this is totally impractical and i'm obviously never gonna attempt it because my oven can't go that high, but, is it possible?

I got thinking after seeing [this] (https://i.redd.it/0b9098solz731.jpg) image, and it got me curious",NoStupidQuestions,Is it possible to bake cookies at 4000 degrees celcius for 1 minute instead of 400 degrees for 10 minutes
KingAffonso,c89jkg,I’m not saying don’t have a religion but fanatics only spread hate and if you don’t live like they want you are like their enemy. I believe that this kind of people are like unevolved from the rest,NoStupidQuestions,Why in 2019 there are still fanatic religious people?
HermitCat347,c8728j,"Not sure if it's a tabboo topic. I've heard how some students hide/bring concealed firearms to school. Then I've heard how there're school shootings in the US. Putting two and two together, why doesn't someone with a weapon just shoot the guy? I'm aware it's not easy to pull the trigger and hit, but I'm just saying all it takes is one person to do it. Just curious.",NoStupidQuestions,Why doesn't someone shoot the school shooter?
Lapiness,c83hrg,,NoStupidQuestions,Is there a makeup product I can use to make my skin looks darker/of hispanic descent? I'm going to cycle through mexico and central america and I don't want to be targeted because I'm a pasty white boi.
VGM_1,c80u3w,"Like my dick is 6” long and like 2” in diameter, and my gf is concerned it won’t fit",NoStupidQuestions,How much can a pussy take?
asiannsfw69,c9s90b,"If you’ve seen her cam videos, you know what I’m talking about. It’s a huge explosion of fucking white and I wanna know how the fuck she does it. [Example](https://www.pornhub.com/view_video.php?viewkey=ph5b1ed8cba284e) FYI: obviously NSFW but there’s also a dude jacking it in the background",NoStupidQuestions,[NSFW] How in the cinnamon toast fuck does Wett Diamond squirt that fucking much
MeowntainMix,ca8t66,,NoStupidQuestions,Is Puss in Boots Spanish or Latino?
Stierscheisse,ca5gtv,,NoStupidQuestions,Why does everybody say blue eyes when they're definitely grey?
throwaway13456737377,ca25z4,^^^^^,NoStupidQuestions,Is it wrong to wear and Ahegao sweater to a sushi restaurant
BlackTopSamurai,ca1zyk,"So a couple of weeks ago, i went to my friend's prom and it was pretty fun. Me and my friend were dancing in the middle where the DJ was,  and i accidentally step on a girl's dress. She told me and I took my shoe off of her dress. I have a size 14 shoe and the shoes i were wearing were very long and jointed. This happened another time about 20 minutes after the first girl and she slapped me because i was ""ruining her dress"". I got really pissed and basically just sat down until the dance floor got cleared. But honestly I really want to know why girls wear long dresses and know that situations like this happen.",NoStupidQuestions,Why do girls wear long dresses?
littlekenji83,c9zudv,,NoStupidQuestions,How often do they update the terms of social media sites across the internet?
littlekenji83,c9zp6s,,NoStupidQuestions,What would happen if you ate all the dirt?
Isa-lizard,c9y5n4,,NoStupidQuestions,Why do I need to put my phone on Airplane mode in the air? How is it affecting the plane?
Launalika,c9wtyg,,NoStupidQuestions,"If we washed our butthole after every time we pooped, starting from birth, would they not be brown?"
terrarialover-51,c9wq81,If someone were to get get monetized on youtube and then make a 10:00 minute video could they put an ad at every second and then call it something dumb like a “challenge” then get like a bunch of money per view? if not please explain why,NoStupidQuestions,(Hypothetical) question
collectorsoftheworld,c9v49r,,NoStupidQuestions,Is it possible to give post sex change people hormones to make them lactate or have milk?
its_a_jokeBTW,c9sdtk,I need help fast!,NoStupidQuestions,"I'm out here trying to be a cool kid, while everyone around me eating soup, what should I do?"
Nick-Conner,c9pej3,,NoStupidQuestions,Could sneezes be a physiological evolutionary tool to quickly 'sober' a person up?
intrepidvoyager11111,c9pddp,Like for instance a mtf trans woman. If they were to stop taking hormones would they undergo puberty even though they’re now an adult. Can puberty catch up and happen once they finish the hormones. Or is it irreversible.,NoStupidQuestions,What happened if someone trans stopped taking hormones after puberty
[deleted],c9ok44,,NoStupidQuestions,Car guys / gals out there. Do you feel conflicted on your passion harming the world?
YaBoiMoseph,c9lneo,"Like when someone says they support gay rights, why is it assumed that they're trying to be ""politically correct,"" and when a company donates to an LGBTQ+ charity they're ""getting involved in politics?"" Shouldn't all humans have rights? Why are they negotiated anyway?",NoStupidQuestions,Why do many people see LGBTQ+ support as political?
Logain_Abler,c9kxt4,"Specifically, she would like to know the full step by step process she'd need to know in her state (WI).",NoStupidQuestions,Friend came out as MTF trans and would like to know all necessary information on the steps of fully transitioning.
GAB__gab__GAB,c9koxk,"A side of my family is Brazilian, they say that celebrating their Independence Day is BS, because it doesn’t mean anything.",NoStupidQuestions,Why do some countries don’t celebrate their Independence Day?
Mestari_1,c9i9zf,How to stop my friend from playing Fortnite?,NoStupidQuestions,My friend...
ManyPandas,c9gz4h,He wasn’t breaking any rules afaik.  Why would he be banned for seemingly no reason?,NoStupidQuestions,Why was u/PeterExplainsTheJoke banned from so many large subbreddits?
BikeBaloney,c9bpi3,,NoStupidQuestions,What is this 'User name checks out' thing? I see it all the time. How does it or does not check out? Plus the 'Edit' thing? Does it really matter if you spelled a word wrong and corrected it or whatever?
dirkdigglered,c9arw5,"If smoking while pregnant can cause developmental issues with children, is it safe to say that baby boomers are not as smart as newer generations?",NoStupidQuestions,"If smoking while pregnant can cause developmental issues with children, is it safe to say that baby boomers are not as smart as newer generations?"
Jamirus2,c99ozf,,NoStupidQuestions,Why is boogy still popular when the only things i see about are horrid? ProJared's career was destroyed by something that affected far less people.
CarbonDemontizide,c99km9,,NoStupidQuestions,Can I get my required water intake fron swallowing my saliva?
Latter_Option,c98ogr,,NoStupidQuestions,Why do we act like girls don't poop/fart/burp ?
Scalby,c98iln,"Are the permeable enough to dry out, or is it little time capsule?",NoStupidQuestions,"I tie my used condoms before throwing them in the trash, Will archaeologists of the future be able to do anything with these little pink jizz bombs in 1000 years time?"
JustALitSnail,c98fhm,"If so, why dont we just put plastic into a giant cat of juice?",NoStupidQuestions,Does lemon juice break down plastic?
NolanRyan2013,c98ff1,"Not talking legally, I'm sure there's fair use exceptions and all that. I'm just talking mechanically, how does one go about getting video/audio from a movie or TV show for your average critique/review? Video I can understand I'm sure there's efficient screen capture software out there, but audio straight from the system/not recorded guerilla style through a mic? Can you just download these things legally? Surely these movies/TV shows aren't just freely downloaded anymore, right?",NoStupidQuestions,How do Youtubers actually procure the video/audio from 3rd party footage to use for critiques/commentaries?
supersouker,c98bns,,NoStupidQuestions,Would clothes have calories or nutritional value if you ate them?
ZaddyXerxes,c2o2tc,"Trans women won't know the struggle of going to work on their period and pretending that everything is okay the same way Rachel Dolezal will never understand the struggle of being a black American even though she ""looks the part"". She can pretend to be black, that doesn't make her ethnically black.  I am fully supportive of the lbgtqai2s+ community, but I'm confused as to why transracial is totally taboo and transgender is accepted.",NoStupidQuestions,Why is transgender pretty well accepted but not transracial?
swiftstreak18,c6oyhj,,NoStupidQuestions,Why do gay people exist?
adeptwarrior,c7dnvl,"Every post I make seems to automatically go to 0. Seems this person is down voting same posts sometimes multiple times. Been happening consistently for a couple weeks. 

 If down voter is reading this suck an egg.",NoStupidQuestions,How do I stop someone down voting all my new posts?
Chairman-Ajit-Pai,c2ff3y,"Try it yourself by sorting by new, all posts are downvoted with a 50% uovote ratio so I guess it's one guy downvoting everything and nobody up voting lol",NoStupidQuestions,Why is someone sorting by new and downvoting everything?
gbpusdforlife,c1u9jg,,NoStupidQuestions,"Am I the only one that thinks quite a few ""no stupid questions"" posts are in fact stupid?"
gallez,bzo2ro,,NoStupidQuestions,Why is it opPOnent but OPposite?
[deleted],bzb9q8,,NoStupidQuestions,Does anybody feel like there's been an uptick of posts making fun of vegans on the frontpage lately?
