author,id,selftext,subreddit,title
SketchersOnMyFeet,c1honx,My friend got pulled over this morning in Chicago by I’m guessing the county sheriff and he got arrested and charged with a DUI. He got released immediately though and I can’t find his mugshot anywhere. I wanted to make shirts with his face on it cause that’s what good friends are for,NoStupidQuestions,Are all mugshots posted online? And how long does it take for them to get posted?
wadermeloun,c41upt,,NoStupidQuestions,If I pump helium up my arse will my farts be high pitched?
PureImmortal,c68t0m,,NoStupidQuestions,Why are blue prints blue?
Taira123,c0esn1,,NoStupidQuestions,Why there is no cat food with mouse flavour?
midnightowl007,c27d6r,,NoStupidQuestions,"When large animals die at a zoo, how are they disposed?"
good_grapes_gilbert,c2zsnr,,NoStupidQuestions,Does nutritional information on gum packaging describe the gum with or without swallowing?
Grerutin,c7ehpn,,NoStupidQuestions,"Do polar bears drink sea water? What about seals? And penguins? If not, what do they drink, and where do they find it?"
lidscrump,c4o0cl,,NoStupidQuestions,Why can’t you highlight text and press “caps lock” to cap/uncap everything at once?
YashitM,c38vma,,NoStupidQuestions,Do you think we could be bacteria living on cells (planets) in someone else's body (universe)?
xPandaVault,c4khhm,I mean can they? Just like blinkers can run out of blinker fluid,NoStupidQuestions,Do car horns ever run out of honk?
KyKlen,c5zidi,"Sometime, cops will have to smash a door or border patrol will disassemble your car, but, they mostly destroy everything. 

Who pay for that ?

Do authorities have permission to destroy anything without repercussions ?

It may differs from countries to countries, how is it different ?

Thanks for answers.",NoStupidQuestions,Do authorities pay for damages they do ?
zrcookspade,c158vw,I could probably eat my whole bottle of sour gummy multi-vitamins before i could stomach to eat two packs of fruit snacks. I sometimes even crave their taste.,NoStupidQuestions,‪Why do gummy multi-vitamins taste better than actual gummy candies &amp; fruit snacks?‬
10100011a10100011a,c0wslo,,NoStupidQuestions,"Except refrigerant, does AC create any negative impact on climate change?"
demarkr,c2wfwh,"Like let's say we could have a super computer could we just use the existing physics equations and simulate every single atom? 
Or maybe simulate the big bang, black holes etc..
I don't really know how to explain it haha",NoStupidQuestions,Could we theoretically simulate the universe?
turtlecake00,c7noxf,I would say yes by default but you never know 🤔,NoStupidQuestions,Are there black Amish people
blacknotekeys,c2n6ou,"This is currently happening.

I'm sitting in the post office parking lot waiting for my boyfriend and this woman in the car parked a couple spaces down looks like she might be asleep? But I can't stop wondering if something might be wrong...
Should I walk up to this random lady and potentially disturb her slumber? Should I call 911? It seems very silly idk....

Help Internet strangers

UPDATE: her husband just came out and opened the passenger door and she woke up she's okay. I'm sorry for being an anxious human Reddit

Edit: answers as to what to do in future situations are accepted thank you",NoStupidQuestions,Should I walk up to this random lady to see if she's okay?
circle_of_snakes,c5prum,"I live in a 500 sq ft apartment with paper-thin walls so it’s impossible not to hear the neighbors. I expect to hear people’s TV’s, radios, whatever and I have no problem with it as long as it’s not keeping me from sleeping. 

However, my next door neighbor has started playing “Hey There Delilah” everyday. Sometimes it’s just in between other songs and other times it’s repeated six times in a row. The time of day is irrelevant, can be 3AM or 3PM. It used to be “Bad Day” by Daniel Powter but I figured the dude was just going through something so I let it be and he stopped after a few weeks. This has gone on much longer though and I just can’t hear this song again. I’ve now heard “Hey There Delilah” more times than my own favorite songs. 

He has a lady friend over pretty often and sometimes she sings along, so my main speculation is that her name is Delilah. I’ve never met a Delilah though, so not too sure.

I’m considering filing a noise complaint but I don’t want anyone to get kicked out for just playing music. I just want him to play a different song because “Hey There Delilah” is starting to haunt my dreams. I know the only real answer is to talk to the leasing office, but what are your thoughts?",NoStupidQuestions,Can I file a noise complaint against my neighbor for playing “Hey There Delilah” on repeat everyday even though it is at a reasonable volume?
FancyRaptor,bzbycd,"No offense to any construction professionals, but as I’m sitting here in construction-related traffic it’s all I can think about.

Edit: Thanks for the (mostly) great answers!",NoStupidQuestions,Why does every construction crew I see have two guys working and twelve other guys standing around?
targetpuller,bz6d76,"Just do a Google News search for ""school lunch debt"" and the results are a tad insane.

[Edit: u/squeaky [has a pretty good answer](https://www.reddit.com/r/NoStupidQuestions/comments/bz6d76/why_has_school_lunch_debt_so_suddenly_exploded/eqrd19b/) and started an interesting thread.]",NoStupidQuestions,Why has school lunch debt so suddenly exploded into a problem in the U.S.? And why isn't school lunch just part of the cost of public education that people pay with taxes and such?
sarcastic_ergonomics,c283wc,,NoStupidQuestions,Why do house toilets have fully oval seats and public restrooms have a chunk missing?
Droer1,bz7012,Is this a common thing? I never post selfies on my snapchat story because I think everybody will think I’m ugly. I never post on Instagram because my life is too boring. I never post on Twitter because I feel like my ideas will be judged. Is anybody experiencing similar issues?,NoStupidQuestions,Does anybody else feel like they can’t post to any social media’s because they’re not interesting enough?
Fuck_Alice,c24gnf,"TLDC: Last night at McDonalds a girl was standing at the drive thru in a light rain and they wouldn't let her order. They also wouldn't let me place an order for her. There was a cop in front of me and boy did he give the dude at the window hell. I'm fairly certain he also paid for her food and I just want to be able to send my gratitude and let the police know that a bystander saw it and wanted to give their appreciation.

I have a picture of the cop, girl, license plate and location/time of when it went down so I hope they would be able to figure out who the cop that actually did it was. I tried Googling it I swear but I couldn't find anything about it for local police.",NoStupidQuestions,Am I allowed to call the non-emergency number to ask them to thank someone for me?
DJse7entyse7en,c5y65p,"From my understanding it's caused by not enough fiber, but what is actually happening at my asshole? Is there actually a turd sticking out that I can't feel or something?
Edit: it's crazy how everyone is giving recommendations on how to clean an ass but no one is answering the question.",NoStupidQuestions,"What is happening when I have a ""I wipe and wipe and wipe, still poop"" moment?"
Octoire,c23upq,"I get that it’s a special thing to say, but usually most movies and series I watch, even people who’re dating for a longer time and meeting each other’s family/friends are super embarrassed when they accidentally speak their mind. 

Is this a culture difference, or is this just a thing in media? I’m Dutch myself and I believe we say I love you (Ik hou van je) a lot easier.",NoStupidQuestions,"Why do American movies always portray saying ‘I love you’ as such a big, scary thing?"
Retizi,c36fl1,,NoStupidQuestions,Has there ever been a major change.org petition that had any large effect whatsoever?
Bayoubanshee,c68o8c,Lunch has left my insides all kinds of messed up  and I’m currently sitting in my bathroom stripped down to my socks because I felt the need to escape my clothing while shitting. Am I as crazy as I currently feel?,NoStupidQuestions,Any of y’all ever had a shit so bad you felt the need to strip naked midway through?
CoffeeSlutt,c43aoj,"I'm not scared of bees, wasps, flies, hornets etc. If I have earphones on and I can't hear them, being around them doesn't bother me. If a wasp is on a wall and I don't have earphones on, I'll keep my distance and probably try to leave the room, not because of the wasp but because it might fly. If I hear it fly, I will dart out the room. 

I'm not scared of insects, I'm scared of the sound they make when they fly. My ears are sensitive to the sound and I hear it louder than any other sound. If a blow fly is on a window and I'm on the opposite side of the room, it will sound like it is right next to my ear. 

It is only the shrill buzzing sound that I'm scared of. Moths and butterflies don't scare me because they don't buzz, they flap. Also the more distressed the buzzing is, the more uncomfortable I am to be around it.",NoStupidQuestions,Does this phobia have a name?
bigkahuna15,c7u4ir,,NoStupidQuestions,"If I was executed by electric chair with my mouth full of popcorn kernels, would they pop?"
TreeOfSpunk,c3gm3v,,NoStupidQuestions,"On Public TV, when the word ""asshole"" is censored, why do they always censor the ""hole"" half of the word and not the ""ass"" half?"
Not_Reverse_Flash_,c73qwv,,NoStupidQuestions,"Is there any work of fiction from the 1700s that tried to predict what life would be like today, like Star Trek did with the 23rd century?"
JMFe95,c1164v,,NoStupidQuestions,"When people say ""say hi from me"", do they actually want you to, or is just an expression?"
Selphish_presley14,c0e1ks,,NoStupidQuestions,Let’s hypothetically say that a basketball player can jump from behind the 3-point line and dunk. Does that count as a three pointer or is there a loophole that makes this a two pointer?
marocu,c0o6kw,,NoStupidQuestions,Do you ever Google a word right after using it to make sure you used it correctly?
UrinalCam_003,c2uyl5,"I am obvs a dude, and while I love getting massages, I feel bad for the staff needing to work on my hairy legs and back. How repulsive do they find me? And should I not go? Im clean and always smell nice, I just don't want to be the client they see and say ""Ugh, this disgusting guy again""

Before anyone suggests shaving it all off or waxing. No :)

Edit: Thank you all for the answers. Now I can safely take me and my hairy self for massages with peace of mind.",NoStupidQuestions,Am I too hairy for a massage?
catty04_thespy,c0dyc5,"I go to the orthodontist and dentist and I always feel super awkward and don’t know if I should close my eyes, or keep them open and just not make eye contact. I’m not sure. can someone help me out?",NoStupidQuestions,Dentists/mouth doctors of reddit- do you prefer eyes opened or closed?
heavyweightgirl,bz9xnp,,NoStupidQuestions,How can I be sure that everybody sees colors as I do?
vertdeferkdude,c2scd1,,NoStupidQuestions,"How much control does a butterfly have on a windy day, or do they just get blown all over the place."
ShesGotSauce,c0ehlc,,NoStupidQuestions,"During most of human history when children had a very high mortality rate, and parents were likely to lose several, did they grieve just as hard for each child's death as they do today? If so, how did people remain psychological intact after so much grief?"
cewallace9,c6if54,,NoStupidQuestions,When you say it’s a west wind..is the wind coming from the west or heading to the west?
LordHazel,c4oz5a,"Here in Israel when you ask someone ""how much you earn"" they'll always say XXXX per month or sometimes XXXX per hour , but never XXXX per year.
But in the U.S. everyone told me their yearly earnings .

edit: so apparently it's common in the USA to get payed weekly or biweekly - which is non-existing in Israel.
The second reason is because Americans use a different taxation system than Israel and other European countries .
Good to know",NoStupidQuestions,Why do Americans calculate their paycheck by yearly earning instead of monthly earning?
CosmicAlicorn,c0fnsz,"Usually when they are half way done repeating themselves I’ll interrupt and respond as if I heard them fine the first time.  

Edit: I have to reiterate it’s never on purpose or to be a jerk. It’s more of a reflex for some reason as half of the time I truly don’t know what they just said. I generally find that it happens less when I’m looking directly at the person since I’m able to lip read and read facial expression.",NoStupidQuestions,Why do I say “what?” to people immediately after they say something even though I know what they Just said? Is it just me?
OpaqueTurnip,c0wenn,"I'm new here and they removed it, what did they say?",NoStupidQuestions,"What was EA's -600,000 downvote comment?"
Ninjaking24,c0r6nb,"Help I'm new to reddit and nobody lets me post :( it keeps saying ""You haven't reached the karma/time threshold don't ask how much you need or we'll f-ing ban you can someone please help me",NoStupidQuestions,HELP
therealone4763,c4309t,"There is a handful of posts with a few hundred upvotes but why isint there more?

Why did venezuelea get tens of thousands of upvotes compared to yemen?",NoStupidQuestions,Why is the yemen genocide not getting any attention on reddit?
1VentiChloroform,c12959,"You'll click it'll go +1, +2, +1, 0, +2, +2, +2, 0, +1

Why

Edit: Unless there are multiple people continuously up and downvoting a post from 2 months ago that only had 5 upvotes to begin with, I don't think it's that people are doing it.",NoStupidQuestions,Why does Reddit upvotes change every single time you refresh the page?
ffourthofjuly,c2xqii,pls this question has not left my brain,NoStupidQuestions,why does soft serve ice cream normally only come in vanilla and chocolate?
Ghostspider1989,c0qb3e,"She justifies it by saying she's saving it from getting ran over. I tell her she's doing more harm than good and that it's against the law in my state (nj).

The turtle just wanders the house all day pissing and shitting all over the place. Probably looking for a way the fuck out. I plan on putting the lil guy back in his natural environment tonight when she's asleep.

And on a 2nd note, how do I convince her to see mental help? My mom unfortunately think she knows better than everyone else so me telling her she needs help won't do it.",NoStupidQuestions,How in the holy of fuck do I stop my mom from taking turtles from the wild and bringing them into the fucking house?
IDrinkH2O_03,c6gdxo,,NoStupidQuestions,Why do I find stuff waaaayyy funnier late at night than at day?
Cre8or_1,bybucj,"In physical sports that makes sense to me, because of physical differences between the genders, but why do men and women compete seperately in chess?",NoStupidQuestions,"In chess, why do men and women often compete in seperate tournaments?"
SpiderMonkey6l,bzl1g3,Say I have two identical 10 tb hard drives and I manage to fill one up while the other is empty. Would there be a difference in weight at all between the two?,NoStupidQuestions,Does my hard drive get heavier the more stuff I download?
TotsNotABot,c2vepz,,NoStupidQuestions,"Why can computers make convincing fake piano, bells, etc. but not convincing fake guitars and flutes?"
makomirocket,c0xj1q,North America or Europe?,NoStupidQuestions,"Could a billionaire buy a whole bunch of land, make a city, but also have T&amp;C's for living there, like ""no littering or you are no longer welcome""?"
DeFormed_Sky,c2z4bp,"I understand that it wouldn't be the safest car ever, or the most ergonomic, but if there's a market for new old cars/trucks, then why don't they make them like they used to with some modern features?",NoStupidQuestions,"If people like the look of old cars, why dont car companies make a new, old car model, with an old style body and some modern safety features?"
fpsrobert99,c4n520,"Recently dropped out of college and and working full time to move in with my gf eventually but I just always feel like one day everything is gonna go to shit. What if I can’t save enough? What if I can’t find a job in her town? What if I get fired from this job? Do I even have the capability to save up that much money?

I just get home from work super tired and feel like my life is at a weird point that feels like a make it or break it point. Does anyone else feel like this? Idk if it’s normal to be this tired and scared for my future both financially and mentally.",NoStupidQuestions,How do people just...get through life?
sarlol00,c3c4dw,Lets assume bikini bottom has US laws.,NoStupidQuestions,"If Plankton succesfully stole the krabby patty's secret formula and started producing them, could Mr. Krabs just sue him out of all his money?"
donttalktomeimfamous,c0w71n,,NoStupidQuestions,"Why is ""mama"" and ""papa"" (or something along these lines) the universal way of calling mother and father?"
VillagerNo4,by89rr,I just want to read my fiction in peace,NoStupidQuestions,Why do parents think my hobbies are a waste of time?
SubarashiiChinChin,aqwf3q,"Most of my American friends and coworkers wear shoes in the house... It's so gross! 

I'm Japanese and I always cringe when I see this.

EDIT:

I have learned today that people don't like it when I ask why they do things. I have had multiple people message me telling me to fuck off and to leave their country alone.

Apologise if I worded it aggressively or something. I really was just genuinely curious. ",NoStupidQuestions,Why do people wear shoes in the house?
sonnyjbiskit,a1zdx0,"I've only met one person that uses it

",NoStupidQuestions,"How is Reddit so popular, yet everyone I ask either doesn't use it or has never even heard of it?"
StaleCraig,acu3go,It's always the happy couple sat on the bathroom floor.,NoStupidQuestions,"Why do pregnancy test adverts never show a relieved young woman looking at a ""Not pregnant"" result?"
PickleDickon,avq5zt,"Last week I was chilling with some friends at the park when suddenly I saw my cat. He looked at me awkwardly and just walked off while I avoided his gaze. It shouldn't be awkward but it is, does anyone know why? ",NoStupidQuestions,Why is it so awkward to meet your cat in the wild?
zenos0,9oeuas,"Story is relevant.

My neighbourhood has a lot of crows. Over twenty of them. They are generally on good terms with one another.

I watched them band together and kill one of the crows. They left its dead body in my yard. I waited until they cleared out and then went outside to clean it up because I don't want crow guts everywhere.

However, one crow was still in eyesight and cawed up a storm. This brought the other crows, and they all started swarming in the air. None of them dove at me but it was clear that they were upset with me doing this.

Now, they congregate and caw aggressively any time I am outside. Some swoop. They are becoming more and more aggressive.

Confusion on why they'd be mad at me for cleaning up _their_ mess aside, how do I repair relations with these crows? I don't want to deal with being attacked every single day by multiple crows. 

Google is not helpful on this front at all. There is surprisingly little documentation on how to make crows like you after you've cleaned up the corpse of one of their peers.


Is it as simple as feeding them every day? Something else? Am I doomed?",NoStupidQuestions,How do you repair relations with crows?
ronnieth024,a0vdit,,NoStupidQuestions,"Why do employers expect a 2 week notice when you're about to quit, but won't give you a 2 week notice when they're about to let you go?"
punnyplueee,bl3jnj,,NoStupidQuestions,"Y'all ever just look at your hands and start wiggling your fingers and think ""holy shit i'm a person in a world, is this reality""?"
Sreichy,aatscj,,NoStupidQuestions,"Does anyone else purposely avoid the top results on Google even though it’s what you want, just because they’re ads?"
bigwillyb123,91gj8l,,NoStupidQuestions,"If tobacco has no accepted medical usage, a high chance of addiction, and causes all sorts of cancers and diseases, why isn't it a schedule 1 drug?"
NoraRose_86,b133jp,"My brother died in a work accident. His drilling rig hit a 12,250-volt overhead power line.

Anyway, would it hurt to die that way? 

He was working the controls, standing on the back of the truck when the arm of the drill hit the power line. Witnesses saw the truck burst in flames, and the fire department wasn’t able to make it to the truck for over an hour. 

I wanted to know if it was instant? Would it hurt? Did he burn alive? 

I told my mom that it was instantaneous and he didn’t even know what happened, but reading online I don’t know if that’s true. 

I’m crying right now, it just sucks and I miss him terribly. 

Edit: For those asking, this accident happened last May. The emotions are raw and fresh again because Easter is coming up and we had all made plans to go to the mountains, last year during that time.

I had cancelled the plans last minute and a few days later the accident happened.

With it coming up again, I just keep thinking why did I cancel? We could have had one last day with him but we didn’t. I want to go up this year, in his memory but I don’t know if I can. 

Edit 2: Thank you everyone for the kind words and thoughts and answers. 

I didn’t think I’d get this many responses, I honestly just randomly wrote this question trying to help myself with the new grief and pain I was feeling in the moment. 

Truly, thank you everyone for taking the time to answer and respond.

My little brother’s name is Joseph. He was 24 years old, and I think of him every single day. ",NoStupidQuestions,"My brother died in a power line accident, did it hurt?"
MikeyMightyena,a472q0,,NoStupidQuestions,"Does anyone else press ""later"" every time when an app asks you to rate it because ""never ask again"" sounds too harsh?"
ThrowMeSomeLove28,bk818i,,NoStupidQuestions,"Is this it? Get a job, have kids and then die and fade into oblivion?"
l-Orion-l,982rwo,"Pretty straight forward.  I like to acknowledge my reflection and drunkness.  Its like I am giving a knod to myself.  Thoughts?


Edit: Wow this post blew up!  I was so tanked when I posted this that I at first didn't know why I had so many inboxes when I logged in today.  Thanks for the Gold stranger,  it has made my hangerover a lot more bearable!",NoStupidQuestions,Does anyone else while inappropriately drunk point in the mirror to themselves and give a grin while walking out of the bathroom?
Mose-Art,bbpxja,"I was reading an article about the picture that was released today which said the Black Hole captured was 50 million light years away. Does that mean that when we look at the picture, we're seeing light that was emitted 50 million years ago? I'm by no means a man of science, but if I remember high school physics well enough then that should be true right? It's incredible if it is",NoStupidQuestions,Does this picture of a blackhole mean what I think it does?
Abbeylayne16,afe587,"I was cutting her nails and she jerked right as I was snipping. She yelled and started bleeding but it’s not bleeding anymore and she’s walking on it just fine. 

I feel so awful, just minutes before we were cuddled up on the couch. :( 

Update: she’s back on the couch with me. We do not deserve dogs ",NoStupidQuestions,I accidentally hurt my dog and now her and my other dog are being weird around me. Will they always hate me from now on or will she eventually forget about it?
Prace_Ace,ayioi9,,NoStupidQuestions,Do americans actually have shredders in their kitchen sinks?
SICFJC,ardbk5,"I blocked her and the texts were super short and completely non sexual. She randomly calls me and I was like shit she sounds super young. I text her and ask if she’s 18. She said yes. Later she texts me and said she was lying. She FaceTimes me and she’s in fucking kid pajamas and says she’s 10 and calls me stupid. 

This is dangerous. What can I do to notify her parents ?  It is an ATT number. Should I call them? 



Edit : I looked up the number on social media. Nothing. I reported it to tinder using their online form. 

She used fake pictures of course. I could certainly tell a 10 year old from an 18 year old. I will not be notifying parents or local agencies of any kind. I reported it to tinder and that’s all I will do. Some parents think their children are perfect and could twist the blame on me instead of themselves. The second she said she was 16 (before she admitted she was 10) I hung up and reported the profile, and unmatched. She revealed she was 10 while I was in the process of blocking the number. 

Even before she said she was under 18 I said absolutely zero things that wouldn’t be okay to say to a ten year old, so I know I’m in the clear. I believe there’s zero case to be made for any sort of enticing or anything like that. ",NoStupidQuestions,"Matched with girl on tinder. Profile said 18, got phone number, she calls and reveals she’s 10."
Irishane,bpolnx,Do you think there was a day when you mixed up their names and it just stuck?,NoStupidQuestions,"Parents with twins, are you 100% sure that both kids have the same name that they started off with?"
BlueEyedMind,91ud8h,,NoStupidQuestions,"Why is President Trump allowed to threaten Iran on Twitter when their own code of conduct says ""You may not make specific threats of violence or wish for the serious physical harm, death, or disease of an individual or group of people.""?"
