author,id,selftext,subreddit,title
Droyk,catfyt,"Yesterday, I bought honey. the cheapest one (Never tasted honey before, first time buying it). after I came home my friend told me, the honey I bought is a processed one, in other words, counterfeit one. after doing a little google-fu, got to know that the honey I bought has added water in it.  it's just a sugary syrup that's all. 

**My Questions are** 

**Q1)** Does the processed honey destroy all the beneficial aspects of raw honey? 

**Q2)** Does the processed honey contain any good vitamins for the human body? the one I bought yesterday is the processed one coz the below tests shows it has water added to it, so should I keep eating that honey? will it provide me with any benefits at all? 

**Q3)** Are the processed and counterfeit honey the same? I mean they are two different naming schemes with different techniques or both are the same just with a different name?

---
because of google-fu, I also got to know that there are ways one can identify the differences b/w the raw honey &amp; counterfeit one/the processed one.

[wikihow](https://www.wikihow.com/Verify-the-Purity-of-Honey) goes in great detail on how to identify one.

**After reading the methods given by wikihow members I got confused as fuck.**

**1)** ***Examining Honey Before Purchasing:*** In my country, the law is it should be just safe to eat. (your typical 3rd world country); **A Dead END!!**

**2)** ***Check the label:*** This morning I wasted my one hour on this and I am pretty sure that every manufacturer in my area print the label with ""the best the rawest"" no other ingredients were written on it. so possibly all of them could be making a dishonest claim to make money; **Another DEAD END!!** P.S. I know for the fact that there is a super expensive manuka honey &amp; After researching about it, I know how to differentiate b/w manuka honey and it's counterfeits through MGO, NPA, UMF but what about other 300+ kinds of honey that are in the market?

**3)** ***Taste the honey if a sample is offered:*** no one offers it in my country, but just for the sake of it let's say someone gives me a sample for the taste now how would I be able to tell if it's a raw or fake one coz there are 300+ types of honey in the market &amp; they all have different characteristics, different texture, smell, taste, etc. **Another DEAD END!!**

**4)** ***Add a spoonful of liquid honey to warm water after buying to see if it's raw or not:*** I am not too sure about this method I did tried this method on the one I bought yesterday &amp; it got dissolved in the water. so now the reason I am not too sure about this method coz of there are 300+ different kinds of honey, different ways to make them. **How would you know for sure that it's a processed one and  ""dissolving in the water"" it's not one of its characteristics?** *There haven't been any studies to be sure about it*.

**5)** ***Drop honey on your thumb if it's pure it'll stay in one place &amp; if it's not it won't:*** hmm, what if the counterfeits just increase their viscosity by adding different ingredients? or what if it's one of its characteristics? how can you tell?  

**6)** ***A matchstick dipped in pure honey will still be able to ignite when struck:*** I tried this method on the one I bought yesterday and it didn't ignite coz of the added water but what if the counterfeits add different ingredients to make the texture thicker not like a normal honey one &amp; say it's a one of a unique honey now how you can tell if it's real or not?

**7)** ***Set fire to a cotton pad or candle wick dipped in honey to check if there's any added water in it:*** again how would you know that for sure if it's not one of its characteristics. I am not talking about the added water. I am talking about if it has a different texture and a way higher thickness the way it won't be able to burn. I don't know if I am making sense here? 

**8)** ***Drop honey on blotting paper or a paper towel:*** I tried this with the honey I bought yesterday and it did leave a mark coz of the added water. now my question is what if the manufacturer uses different counterfeit material instead of water. how would I be able to point out the difference?

---
**&amp; forgive me, I know all this is confusing due to my lack of better wording. also, I am not good with my English so be sure to point out any grammatical mistakes you found while reading this post. it's gonna help me improve my English.**",NoStupidQuestions,[Enlighten me] There are 300+ unique types of honey available in the market; So how would a layman know he is buying real honey and not the counterfeit/processed one?
AgonizingAnxiety,catfu3,"Like if someone wants to post one of their friends stories on an r/askreddit question, what would they start it with. E.g &lt;Insert word here&gt;, not my story.

(For some reason I keep remembering an answer that said ""Obligatory, not my story..."" but the definition doesn't match.)",NoStupidQuestions,Is there a word that means that something you're doing/saying isn't something of your own?
AmusementRyder,catfny,,NoStupidQuestions,Why is it called an ice cream “truck” when it’s really a van?
Brennanvg11,cath14,For example i saw a video on baby turtles and how once they are born they immediately move to the ocean and start swimming away,NoStupidQuestions,Why is it that humans arent born knowing how to walk but most other animals know how to move
TheLastEmoKid,cathfw,"We are heading towards an election in my country and one of the topics that always comes up is job creation rates and housing under certain leaders, but ive never had it explained to me how exactly a politician influences that.   If the economy is driven by wealth generation and peoples spending habits, I dont see the connection that a political leader had in shaping that.  Surely, expansion plans of a company, or the swells of the housing market take longer than the standard 3-5 years of a term, i would think.",NoStupidQuestions,"When people talk about politicians creating jobs or building homes, how does the politician actually do that?"
Latter_Option,cathrp,,NoStupidQuestions,"When native American tribes buy land unattached to the reservation, does it become a part of the reservation?"
Sad_AsianKid,cati8b,"Ok, so I was convinced to ask my parents to take me to therapy for my increasing loneliness and sadness, but they just ended up making fun of me and telling me to deal with it. I kind of gave up after that, but I really want some professional help before it gets worse. Where do I go to get help? Is there some sort of way to keep this from my parents?",NoStupidQuestions,How do I get therapy without asking my parents?
DJse7entyse7en,catj4f,,NoStupidQuestions,"Why are so many sports teams named after small birds? (Orioles, Cardinals, Bluejays, etc.) How are small birds fierce?"
devilfangz,catjy5,I feel like I should clarify this is out of pure curiosity. My friend and I are debating whether it’s still rape if two people try to rape each other. She says it’s not rape because it’s “consensual” and both sides wanted to have sex. I argue it’s still rape because rape isn’t consensual. Any help?,NoStupidQuestions,"If two people try to rape each other at the same time, is it still rape?"
VishaKanya18,catjvc,"Alright creative peeps- I have 8 butterflies to name. I want to name them after celebrities with a butterfly twist. For example- for fish we had Swim Shady, Gilly Nelson, Anthony Hopfins etc. so far for the butterflies I have Marty McFly... What do you have for me? Thank you! (Extra points for humor)",NoStupidQuestions,Name my butterflies!
malten_sage,catjr5,I know I have the feature but I was wondering what are some places where I can do that at? Kind of like how the library lets you print off of their computers.,NoStupidQuestions,Where are some places that will let me print via iPhone AKA air print?
penguinneinparis,catjkb,,NoStupidQuestions,Did Dinosaurs have civilizations on the level of stone age people? Why or why not?
drunkbackpacker,catkj6,,NoStupidQuestions,"What’s the difference between public land, BLM, and national forest/parks?"
PuffyPuffyPuffPuff,catk8s,"Basically, is it possible for a person to speak loud enough for the vibrations caused by it to be strong enough for a deaf person to feel it? Would you need to be an especially loud or especially deep-voiced person for this to work?",NoStupidQuestions,"How loud and deep would you have to yell for a truly deaf person to be able to ""hear""/feel it as a vibration?"
privatenuisance,catl48,,NoStupidQuestions,"If the phone companies plan on countering robo calls by blocking inactive numbers, what’s going to stop these organizations from buying all the unused numbers?"
greatgregru,catlz3,"So I know it’s illegal to be nude in public, but what if I were to wear a shirt with a picture of me naked on it out in public? That can’t be illegal right?",NoStupidQuestions,Naked in public...
watstherate,catlx1,"I think it could potentially be a fun idea in theory, I’m having a hard time coming up with a way it could work though.",NoStupidQuestions,What would be the best way to incorporate Game Theory or The Prisoners Dilemma into a drinking game?
Sychotics,catlun,"I've been unemployed for 3 months now, it's taken a HUGE toll on me, socially and mentally. I barely talk because I have no one to talk to, I probably say 10 words a week max. I spend maybe 5 days a week at home, uncomfortable going out. 

How can I regain my confidence and stop this anxiety? I'm trying to get a job, but I haven't been getting any luck.",NoStupidQuestions,How to regain confidence after being unemployed?
Sychotics,catlun,"I've been unemployed for 3 months now, it's taken a HUGE toll on me, socially and mentally. I barely talk because I have no one to talk to, I probably say 10 words a week max. I spend maybe 5 days a week at home, uncomfortable going out. 

How can I regain my confidence and stop this anxiety? I'm trying to get a job, but I haven't been getting any luck. Even the minimum wage jobs, i'm not getting any responses.",NoStupidQuestions,How to regain confidence after being unemployed?
YuriAddict7,catmkg,seems like stuff like push and dealer must stand at 17 are made to favor the players but we know thats not true,NoStupidQuestions,do dealers have any advantage at blackjacks?
sirbroseiden,catm94,Flying seems like it should be more costly,NoStupidQuestions,Why are train tickets more expensive than airfare?
Sychotics,catlun,"I've been unemployed for 3 months now, it's taken a HUGE toll on me, socially and mentally. I barely talk because I have no one to talk to, I probably say 10 words a week max. I start rapping to songs and talking to myself, in hopes I don't lose my ability to communicate. I spend maybe 5 days a week at home, uncomfortable going out and no money to even go out. 

How can I regain my confidence and stop this anxiety? I'm trying to get a job, but I haven't been getting any luck. Even the minimum wage jobs, i'm not getting any responses.",NoStupidQuestions,How to regain confidence after being unemployed?
thatsOKbro,catnrl,"I’ve tried many times but always give up because it’s so much work. My breakfast is fairly easy but when it comes to lunch, I can’t measure how much say salad greens I’m using (I usually make a salad at my work) and I can’t measure out the amount of chicken in it, stuff like that. 

Then when I make dinner, I use so many different ingredients. Its so hard to figure out even within 100 calories of how many calories I’m taking in with a meal. I’m trying to lose weight but it’s not really working lol",NoStupidQuestions,What’s an easy way to keep track of calories?
Latter_Option,catogu,,NoStupidQuestions,"Is it true indian reservations are independent countries, not under the authority of the united states?"
schwol,cato4v,,NoStupidQuestions,[Mobile Reddit] How long have those arrows beside the comment box in the bottom right of your screen existed to skip you to the next comment thread?
Droyk,catfyt,"Yesterday, I bought honey. the cheapest one (Never tasted honey before, first time buying it). after I came home my friend told me, the honey I bought is a processed/pasteurized one, in other words, counterfeit one. after doing a little google-fu, got to know that the honey I bought has added water in it.  it's just a sugary syrup that's all. 

**My Questions are** 

**Q1)** Does the processed/pasteurized honey destroy all the beneficial aspects of raw honey? 

**Q2)** Does the processed/pasteurized honey contain any good vitamins for the human body? the one I bought yesterday is the processed one coz the below tests shows it has water added to it, so should I keep eating that honey? will it provide me with any benefits at all? 

**Q3)** Are the processed, pasteurized and counterfeit honey the same? I mean they are three different naming schemes with different techniques or all of them are the same just with a different name?

---
because of google-fu, I also got to know that there are ways one can identify the differences b/w the raw honey &amp; counterfeit one/the processed one.

[wikihow](https://www.wikihow.com/Verify-the-Purity-of-Honey) goes in great detail on how to identify one.

**After reading the methods given by wikihow members I got confused as fuck.**

**1)** ***Examining Honey Before Purchasing:*** In my country, the law is it should be just safe to eat. (your typical 3rd world country); **A Dead END!!**

**2)** ***Check the label:*** This morning I wasted my one hour on this and I am pretty sure that every manufacturer in my area print the label with ""the best the rawest"" no other ingredients were written on it. so possibly all of them could be making a dishonest claim to make money; **Another DEAD END!!** P.S. I know for the fact that there is a super expensive manuka honey &amp; After researching about it, I know how to differentiate b/w manuka honey and it's counterfeits through MGO, NPA, UMF but what about other 300+ kinds of honey that are in the market?

**3)** ***Taste the honey if a sample is offered:*** no one offers it in my country, but just for the sake of it let's say someone gives me a sample for the taste now how would I be able to tell if it's a raw or fake one coz there are 300+ types of honey in the market &amp; they all have different characteristics, different texture, smell, taste, etc. **Another DEAD END!!**

**4)** ***Add a spoonful of liquid honey to warm water after buying to see if it's raw or not:*** I am not too sure about this method I did tried this method on the one I bought yesterday &amp; it got dissolved in the water. so now the reason I am not too sure about this method coz of there are 300+ different kinds of honey, different ways to make them. **How would you know for sure that it's a processed one and  ""dissolving in the water"" it's not one of its characteristics?** *There haven't been any studies to be sure about it*.

**5)** ***Drop honey on your thumb if it's pure it'll stay in one place &amp; if it's not it won't:*** hmm, what if the counterfeits just increase their viscosity by adding different ingredients? or what if it's one of its characteristics? how can you tell?  

**6)** ***A matchstick dipped in pure honey will still be able to ignite when struck:*** I tried this method on the one I bought yesterday and it didn't ignite coz of the added water but what if the counterfeits add different ingredients to make the texture thicker not like a normal honey one &amp; say it's a one of a unique honey now how you can tell if it's real or not?

**7)** ***Set fire to a cotton pad or candle wick dipped in honey to check if there's any added water in it:*** again how would you know that for sure if it's not one of its characteristics. I am not talking about the added water. I am talking about if it has a different texture and a way higher thickness the way it won't be able to burn. I don't know if I am making sense here? 

**8)** ***Drop honey on blotting paper or a paper towel:*** I tried this with the honey I bought yesterday and it did leave a mark coz of the added water. now my question is what if the manufacturer uses different counterfeit material instead of water. how would I be able to point out the difference?

---
**&amp; forgive me, I know all this is confusing due to my lack of better wording. also, I am not good with my English so be sure to point out any grammatical mistakes you found while reading this post. it's gonna help me improve my English.**",NoStupidQuestions,[Enlighten me] There are 300+ unique types of honey available in the market; So how would a layman know he is buying real honey and not the counterfeit/processed one?
Adipay,catp98,,NoStupidQuestions,"Because similar species can produce offspring (ligers etc.), is it possible to produce a Human-Chimpanzee hybrid? If so, how would it behave?"
MrsZapRowsdower,catovi,"Let's say I ate a sandwich that was 500 calories. An hour later, I vomit. Did I essentially burn those 500 calories I consumed? If not, did I at least lose some of them? Is this even possible to quantify?

I should mention that I am not bulimic. I've just started tracking my calories in an effort to lose weight. I was just curious if I were to consume a certain amount of calories and then I were to vomit later on (say due to food poisoning or, more likely for me, getting nauseous on a long car ride), would I be able to take back any of those calories as though I didn't consume them? I just want to be as accurate as possible in case this scenario comes up.

Thanks!",NoStupidQuestions,Does vomiting give get rid of the calories you consumed?
theythemweus,catpnb,,NoStupidQuestions,If every time I talk to my ex and she always ask for money did she ever love me?
high_pH_bitch,carvn1,"Edit 1: “moist” doesn’t bother me, but I realized I really dislike the word “anoint” for no particular reason.

— Edit 1.1: “joint” bothers me. “Point” doesn’t. I don’t know what is real anymore.

Edit 2: Moisssssssst

Does that make it worse?",NoStupidQuestions,"Do people who dislike the word moist have a problem with hoist and oyster too, or is it something about the M?"
Saurtripp,catqhq,"You know how you’re watching a couple of cartoons and you see some anthropomorphic animals that fall in love?

So in these cartoon universes, how would making a baby work? Would the offspring come out as some mixed between both species? Or would the offspring be of chance and take the form of only one of the parents? Or would babies even be made at all?

I guess I’ll give an example. You know Zootopia right? There’s the bunny and the fox that fell in love (if I remember correctly) at the end of the movie. So would they even be able to have a child?

I feel like I'm over thinking this but I just want some answers.",NoStupidQuestions,How do interspecies couples work?
thepr3tty-wreckless,catq24,"I normally drink a LOT of water. Like. 2-3 liters a day, but I seem to ALWAYS be thirsty no matter how much I drink. It also appears to me that my friends who don’t normally drink water and substitute for sodas more regularly don’t experience the same “parched” feeling I have if I don’t have a water bottle next to me at all times. 

Is there an explanation for this? Does my constant hydration make me more aware of the effects of dehydration compared to my friends who are in a constant state of dehydration? Or is there something wrong with me?",NoStupidQuestions,Does being normally hydrated make you feel the effects of dehydration quicker or more strongly?
ElChapoC-137,catqnh,I am high.,NoStupidQuestions,Could we ever drink all of the water on Earth?
Saurtripp,catqhq,"You know how you’re watching a couple of cartoons and you see some anthropomorphic animals that aren't from the same species fall in love?

So in these cartoon universes, how would making a baby work? Would the offspring come out as some mixed between both species? Or would the offspring be of chance and take the form of only one of the parents? Or would babies even be made at all?

I guess I’ll give an example. You know Zootopia right? There’s the bunny and the fox that fell in love (if I remember correctly) at the end of the movie. So would they even be able to have a child?

I feel like I'm over thinking this but I just want some answers.",NoStupidQuestions,How do interspecies couples work?
Pygmalion_Galatea,catrbd,"The OP has multiple posts made up in the same format, where the person finds the post about them on Reddit.

An example: [https://i.imgur.com/IPkPkFU.jpg](https://i.imgur.com/IPkPkFU.jpg)",NoStupidQuestions,Why do the people believe the ChoosingBeggar story on the front page?
KawhisButtcheek,catr5o,"I need an imitation substance for Fentanyl for a school project. I'm assuming grain size, density and cohesion is gonna be important to imitate Fentanyl.

Got any suggestions?",NoStupidQuestions,Whats the closest easily available powder that acts like Fentanyl?
DocLeWolfe,catqyf,,NoStupidQuestions,"Where does the term ""Soviet"" come from?"
Dangerous_Wishbone,catrfo,We just see him walking weird and kicking the air and then he got the hell arrested,NoStupidQuestions,"What did Zack get in trouble for in the ""Zack stop, you're gonna get in trouble"" vine?"
isaiah5417,catrog,"Long story short, I went through unemployment hell and now I get to start work. Trouble is, I’m super used to having the whole day to do nothing. My brain has been on vacation since March! How can I prepare?",NoStupidQuestions,I’m starting my first day of actual work after 6 months unemployment &amp; 2 days training. How do I get my brain back into work mode?
tealface00,catrlq,"im thinking chinese take out, subway, chipotle, or panera. which one would you go with? im trying to gain weight so all that extra fat and stuff is fine",NoStupidQuestions,Healthiest fast food option?
Pygmalion_Galatea,catrbd,"The OP has multiple posts made up in the same format, where the person finds the post about them on Reddit.

An example:

[https://i.imgur.com/OFDex1W.jpg](https://i.imgur.com/OFDex1W.jpg)",NoStupidQuestions,Why do the people believe the ChoosingBeggar story on the front page?
BigRecognition6,catsp5,I'm aware one time exposure is not too risky but I'm wondering if the fibers stay in there anyway.,NoStupidQuestions,"Does one time exposure to asbestos, even on small levels, bring the fibers to your lungs and stay there forever?"
Munky7,catso5,"I'm looking for a website, or a person, where I can invest, and safely get 1% return. If you have any info, I would appreciate it.",NoStupidQuestions,Where can I get a safe 1% return investment?
djlynch24,catshb,"I have my first job interview out of college and I am going shopping for interview clothes and I guess I'm just taking caution. I've heard mix views that job interviews aren't that uptight anymore and i've heard ""wear a suit anyway, no one will care if you are overdressed"". so that being said, should I wear a full suit or can I get away with some nice dress pants, buttoned shirt, and a tie.",NoStupidQuestions,Is it still customary to wear a full suit to a job interview?
NeoPlague,catsds,"When Earth was born, plants had to come before animals. So, how does the emergence of animals come to be, and if, even if a brief period, there was nothing but plant life, is that even fully sustainable for a planet?",NoStupidQuestions,"Could Earth have supported only plant life, in the infact of it's conception?"
KawhisButtcheek,catr5o,"I need an imitation substance for Fentanyl for a school project. I'm assuming grain size, density and cohesion is gonna be important to imitate Fentanyl.

I tried granulated sugar but I’m not sure how close that is to the actual thing.

Got any suggestions?",NoStupidQuestions,Whats the closest easily available powder that acts like Fentanyl?
theythemweus,catpnb,"We were together for years she left state now every time we talk she always ask for money, looking for a female prospective does she just look at me like a sucker or is she just asking cause she assumes I have it?",NoStupidQuestions,If every time I talk to my ex and she always ask for money did she ever love me?
scaredofexisting,catu2d,"So I suffer from severe depression and anxiety, to the point where I'm basically non-functioning. Lately. I've been drinking a LOT over the past several months, like 8 to 10 or more shots of vodka a night. I'm a small female, 5'2"" and 140ish pounds. I take 300mg?(cannot remember the measurement) of Effexor a day, plus 1 15mg? of amyltriptaline a day for my issues, and over the past few days 1 or 2 500mg Tylenol to deal with my splitting hangover headaches, even though I know not to do that (I refuse to leave the house and my husband never remembers to restock my ibuprofen stash, so got desperate.) My question is, have I fucked up my liver? Am I in trouble?",NoStupidQuestions,Am I in trouble with my liver after this series of dumb choices?
sviper404,catts7,"So I have a bad respiratory infection and last time I went to the doctor for something similar it cost $150 out of pocket for the visit and to get a prescription. I didn’t want to take the medicine because I was convinced it wasn’t that bad, then my mom stole the medicine and took it for herself. Now a year later I have it again worse but don’t want to shell out all that money. They don’t sell antibiotics otc here and you need a perscriotion. I’ve heard that they sell antibiotics for fish and dogs online and that it’s the same exact drug as they give out for humans but no prescription required to order it. Is this true? Not looking for sympathy since it’s my own fault for smoking too much shit I’m just looking for answers.",NoStupidQuestions,Can you buy antibiotics online without a prescription?
