author,id,selftext,subreddit,title
Tracaine2019,ca67vn,Title basically. I told the home owner and they called the cops but it's my word against theirs. I really don't want involved if there's legal action taken but that poor dog...,NoStupidQuestions,I just saw someone go off the road into someone's yard to run over their dog. I got the license plate but can't prove it. What do I do?
globalklaus,ca5ovt,,NoStupidQuestions,"If you're in a spaceship, right outside the edge of the event horizon of a black hole, and then you send out a camera, which is connected to an insanely long fiber cable, passed the event horizon - would you have to wait millions of years for the live feed, or would you see footage in real time?"
[deleted],ca61kk,It is basically a vibrating seat? Also talking more super bike vs scooter.,NoStupidQuestions,Do girls find it arousing/does it feel good riding a motorcycle?
iCryKarma,c9vyvp,,NoStupidQuestions,Why do cities plant big-ass bushes at intersections that block the view of the road?
ohlordwhywhy,c9ufdx,And I don't mean spoiled food.,NoStupidQuestions,"If food takes several hours for food to go through the digestive system, why do some meals seem to have an immediate effect on bowel movement"
APeacefulBard,ca2jkd,"I have no idea at all how to use tampons, maxi pads, what have you. I don’t know what kind to buy or how to apply them. My kid is ten and while I hope she doesn’t start for a while yet I think I should be prepared for when it does. How do I educate her own these things without mortifying us both, especially when I have no idea myself.",NoStupidQuestions,What do you do when a girl gets her first period and you’re a single dad?
Sliffer21,ca7fqy,"So out of curiosity, why doesn't the father who wanted to put Spiderman on his son's gravestone just do it anyway? Doesn't IP laws only really protect commercial use of an IP? Since the father obviously isn't making money off of it there would be no monetary damages Disney could come after. Or is this more of a r/legaladvice question?",NoStupidQuestions,Disney gravestone question
Tobiaskos,ca5ra4,,NoStupidQuestions,Would i be charched with manslaughter if my hammer at a construction fell on a head of a person and kkilled them because they weren't wearing a helmet ?
Potato_Cato,c9y0op,"Idk it happens sometimes and pisses me of.

Thanks for all the answers. I think that u/RHA27 has the right clarification for that... Phenomenon.

Btw that kinda blew up. :P lol",NoStupidQuestions,"Am I the inly one who gets this ""unlocalized itch""? Like when your elbow itches, you scratch it and realise it's not the real source so you go on to scratching your whole arm and ""find"" nothing?"
Infour,ca71l1,I'm beginner to car and i wish to learn in and out about it. Just so you know i didnt own a car but just for the future i want to learn it. Which reddit and/or youtube are the best for car guide? I'm going to learn about it using youtube and reddit.,NoStupidQuestions,Best reddit for car beginner?
TwinMarsh,ca6kmm,"I've looked them up a little bit and I think they're called Red Clover Mites, but I couldn't find any explanation as to why they just seemed to dissappear. I remember swarms of these things appearing in my childhood but I haven't seen a single one in years. What happened to them? Did they just go extinct in certain places or something?",NoStupidQuestions,What happened to those tiny red bugs that always appeared in Summer?
Antonis_8,ca73oo,"You know, those low effort games no one downloads? That somehow manage to advertise on every single app/website? How? Is advertising that cheap nowadays?",NoStupidQuestions,How do these shit mobile games have so much budget for ads
notharrystylesatall,c9w904,"I'm not even joking here. Idk if other girls do it lmao. But, I sometimes just hold my boob for some reason. Anyone else?",NoStupidQuestions,You ever just hold your boob?
Galopus,caa4wi,"I am talking about severe alzheimer here, I mean if they keep forgetting about last time they heard it, it's like first time everytime the hear the song, and they would never get bored of it.",NoStupidQuestions,"Can people with alzheimer listen to the same song over and over again, and never get bored of it?"
Disclosinq,ca6opm,"I was taking a whiz the other day and it came out clear, so of course the first thing I asked myself was whether or not it was safer to drink.

I know people have drank pee in the past as a last resort, and obviously it would be a difficult task to get perfectly clear pee in a survival situation, but I'm still curious.",NoStupidQuestions,"In a survival situation, would clear pee be safer/better to drink than more yellow pee?"
horses_and_hunting,ca636z,,NoStupidQuestions,Explain to a foreigner why Bob Ross is venerated?
BenHara983,ca81bt,"In response to a grandayy tweet about Disney not letting a dude put Spider-Man on his son’s grave Dolan Dark said “I’m gonna get a tattoo of Spider-Man on my cock and balls and there’s nothing Disney can do about it”.

Firstly, is this statement legally accurate?

Secondly, if one where to get a tattoo on the balls would Disney’s lawyers have to look at said balls to confirm that it is a copyright infringement?",NoStupidQuestions,Would Disney have to look at my balls if I got a tattoo of Spider-Man on them?
BirdLuger19,ca7lsu,"If you've been dating her awhile and live together. My gf loves me grabbing her butt when shes awake most of the time and I go to bed later than her, so when I come to bed I usually get a handful of butt before turning over",NoStupidQuestions,Is it normal to grab your girlfriends butt while shes sleeping?
gobblednort,ca5rpy,,NoStupidQuestions,Does having sex with a zombie make you a necrophiliac?
ixpantenco48,ca7snj,"I honestly don't understand, like everybody knows their part? It's not like they're gonna suddenly forget how the piece goes, right? I mean, a choreographer isn't there on stage everytime a dance routine is presented. 

Is it just tradition or do they do something my monkey brain isn't getting?",NoStupidQuestions,What exactly does a conductor do in an orchestra?
AlwaysPersistent,ca65vb,,NoStupidQuestions,"If I delete my Facebook account, what does it look like after the 30 day period? Do all messages I sent on messenger disappear? Is my name/dp shown?"
donttalktomeimfamous,ca7bpg,"There are like ten websites. Why do people still download them? Why would anyone make a ""homework"" folder and risk getting caught while they can just literally watch online?",NoStupidQuestions,Why do people still download porn?
littlekenji83,ca9t62,,NoStupidQuestions,What happened to Rock n’ Roll music?
bobbybuddha,ca9moj,Mail not nail.,NoStupidQuestions,"Why do people in the US get their nail delivered to a little box OUTSIDE their house, but we in the UK get it posted through our letter boxes INSIDE through our front doors? Anyone can surely steal the mail from the little box?"
Slightly-burt-cabage,ca5x80,When talking to people about America when people call it the red white and blue country/ use it for patriotism I’m always confused because there are so many flags that are red white and blue and it’s not like America was the first country with those colors.,NoStupidQuestions,Why is America considered the “Red white and blue” country when there are so many other countries flag have those colors?
LeChefromitaly,caa9lt,,NoStupidQuestions,"If i boil a turd for 10 minutes, does it become safe to eat cause the bacteria died?"
TheAmateurSuperhero,ca9rnb,,NoStupidQuestions,Why can't we stop that one thing we know is bad for us? Why aren't we in control of ourselves?
NevercancheesePerish,ca7q6e,I fully support all relationships types. Just curious.,NoStupidQuestions,Why do individuals who are homosexual frequently adjust their appearance to look comparable to the sex they aren’t attracted to?
anonymousboi98,caaooz,"I used to vape alot but then i quit, this weekend was a one off bachelor party so....im not gonna be continuing tommorow when we get back.....Also if so how long will the withdrawals last?",NoStupidQuestions,I was vaping my friends JUUL the whole weekend and drinking. Am i gonna go through nicotine withdrawals now?
jumaiza,caa2zu,,NoStupidQuestions,Why do Lesbians usually have short hair if short hair resembles guys?
runninguitarist,caamdp,,NoStupidQuestions,Why don't we have a right to exist without being bombarded by ads?
plan_with_stan,caaaoh,,NoStupidQuestions,"Why, on some days, am I insanely clever and switched on (for example at work) and on some days I’m a complete idiot who cannot contribute one good thing to anything?"
agrandthing,caavkx,,NoStupidQuestions,Are yellowjackets affected by the caffeine they ingest when they get into pop cans?
SumTingIsVaryWong,ca93si,,NoStupidQuestions,Why was Donald Trump voted in when Hilary got more votes... are certain states valued over others?
T-H-I-N-N-,cab2uh,,NoStupidQuestions,How can I stay up all night without coffee?
notathrowawaypornacc,caaybt,"15M

I have never used deodorant in my life. I didnt even know normal people used deodorant until the other day when my friends and i were talking about it. They thought it was gross, but admitted that I don’t give off an odor. I asked my dad if he used deodorant and he said no. Im chinese and have barely any hair on my legs arms or armpits, etc. I never get sweat stains on my armpits. I don’t sweat much, even when running cross country. Is not wearing deodorant gross?",NoStupidQuestions,What’s the deal with deodorant?
verycuriousbear,cab77u,"I was at a convention and I was at a merch booth when a girl came up in cosplay. Her chest was right where I was looking and I noticed part of her nipple. Is there a way to approach that?

To note, I am a guy.",NoStupidQuestions,"If you see a girl’s nipple in public, should you tell her? If so, how?"
Tracaine2019,ca67vn,"Title basically. I told the home owner and they called the cops but it's my word against theirs. I really don't want involved if there's legal action taken but that poor dog...


Edit: So the cops asked me to file a report on what I saw. The guy is saying the tire tracks in the yard are from where he was swerving to try and miss the dog because it was in the road. 


I was asked if I'd at least give a statement to the prosecuting attorney if asked, which I said I would do. I just don't want on the witness stand in a trial or something. I'm not sure what happens from here but if I find out I'll share an update. Thank you for all the advice guys.",NoStupidQuestions,I just saw someone go off the road into someone's yard to run over their dog. I got the license plate but can't prove it. What do I do?
cokesniffingmonkey,cabn50,,NoStupidQuestions,What did bedbugs do before beds?
millanstar,cabkj2,and who collectively decides on what is consider art and its order?,NoStupidQuestions,"If cinema is the seventh art, what are the other art numerations and how many are there?"
paperplane17,cab8yi,"There are so many web browsers, and a ""war"" over market share.... but what do they get out of it? How is it profitable enough to warrant consistent updates and feature improvements. In fact, how is it profitable **at all**?",NoStupidQuestions,What incentive is there to make a web browser?
JodieJodieJodie30,cabbps,,NoStupidQuestions,How can people tell the difference between a movie that was written fine but delivered poorly &amp; a movie that was written poorly but executed to its best possible ability?
hipposwearingtutus,cabsu0,"So. Today, after over two years together, I discovered an odd fear of my partner’s.

He reached into our cutlery drawer, and unbeknownst to him, our housemate had added new cutlery. These particular pieces have holes at the bottom of the handle (the type they put in for hanging cutlery), and my partner freaked out.

He said the concept just made him feel awful, and he physically could not touch them to get to the holeless forks. He hasn’t got a clue why this is, but is aware of it as a fear. So....anyone got any clues what kind of fear this is/what the cause could be? It’s blowing my mind.",NoStupidQuestions,My partner has an irrational fear of cutlery.
mampatrick,cabxcz,"there's quite a bunch of blood around, I can see the bone of one of its back legs, and it's front legs seem malformed, is there anything i can do?",NoStupidQuestions,"My dog has given birth to a dog without legs, its there anything i can do to ease the pain or anything? (NSFW)"
microweave,cac2gm,Obviously this question doesn't apply to bluetooth/wireless headphones.,NoStupidQuestions,Does your phone battery drain faster when you have headphones plugged in?
reggit99,cac78x,,NoStupidQuestions,Are there wild chickens? Like are there chickens that are not domesticated and somehow survive in the wild?
tehlolredditor,cac84g,"Ok, we have two extreme groups. These are the people who I think are having the mudslinging. ""Oh fuck disney, no black ariel that's wrong"" ""Oh fuck you, you racist!""

At worst, ok, disney is pushing more characters to change races just because of convenience or to stir controversy or just because they can. Soooo what? It's just a fucking film! Having one or a couple of race bent disney films isn't going to drastically change the social fabric of society.

A lot of people just seem scared, anxious, annoyed, or angry, and you have a bunch of others on the opposite aisle responding to that. But it's like I dont get it! So much emotion dedicated to this thing in particular. I mean you do you, but I don't get it!!

This is like, Starbucks Cup, Happy Holidays type of outrage. Maybe it's just a bunch of retarded kids",NoStupidQuestions,What is actually the problem these people have with a Black Ariel?
tehlolredditor,cac84g,"Ok, we have two extreme groups. These are the people who I think are having the mudslinging. ""Oh fuck disney, no black ariel that's wrong"" ""Oh fuck you, you racist!""

At worst, ok, disney is pushing more characters to change races just because of convenience or to stir controversy or just because they can. Soooo what? It's just a fucking film! Having one or a couple of race bent disney films isn't going to drastically change the social fabric of society.

A lot of people just seem scared, anxious, annoyed, or angry, and you have a bunch of others on the opposite aisle responding to that. But it's like I dont get it! So much emotion dedicated to this thing in particular. I mean you do you, but I don't get it!!

This is like, Starbucks Cup, Happy Holidays type of outrage.",NoStupidQuestions,What is actually the problem these people have with a Black Ariel?
VisionGoku1,caclb9,I saw a news article about this but I can't tell if it's trolling or not. It said something about how goats from France and Germany can't understand each other's accents and even get into goat fights over it.,NoStupidQuestions,Is it true that goats have accents?
Alajos_,cacaud,"For example, can the 2020 democratic candidate choose Barack Obama or Bill Clinton as his VP?",NoStupidQuestions,Can a US President be somebody else's Vice President after he did two terms?
levi61,cabvnx,I have a bad habit. sometimes when ı drink with friends(maybe 1-2 times in a month) I smoke 1-2 cigarette. im not a cigarette addict and I never was. İt feels good but afterwards I really regret it. because im a athlete (wrestler) and I really wonder How long does it takes for lungs to clear itself from 1 cigarette.,NoStupidQuestions,How long does it takes for your lungs to clean itself from 1 cigarette ?
real_shadowave,cac6np,,NoStupidQuestions,"If a human baby was raised by wolves or any other animal, like Mowgli. Would the baby be able to communicate with them, however complicated their form of communication is?"
travisstannnn,cacxix,"I’m sure you’ve all had that poop where you felt completely empty after and only one wipe was needed, any advice how to get that all the time?",NoStupidQuestions,"How to achieve that empty feeling, nothing left, one wipe poop?"
KeisukeMito,cacw27,,NoStupidQuestions,What's wrong with Comic sans?
Battlepro77,cacx9h,,NoStupidQuestions,"Do dogs in general care about Decorations (furniture, lights and other) or just don’t care?"
Ghost-Mechanic,cacvyj,,NoStupidQuestions,Why don't we get sick from the poop inside us if it has bacteria and stuff
c_anthony,cadbr8,"This has been driving me insane lately. The older I get the more I notice that everything is so ridiculously over complicated. You look at anything that should be simple, such as (for an example) a job stocking shelves at a small grocery store. You get hired in and suddenly there's going to be computer based learning modules, 1,000 acronyms to memorize, and infinite details and procedures for something that should be so simple. (please note that job was just an example I came up with, not the purpose of this post)  
&amp;nbsp;  

It absolutely drives me insane. Why do we apparently feel the need to over complicate and obfuscate absolutely everything?",NoStupidQuestions,Why do we over complicate *everything*?
_dysfunctionalfamily,cad83g,Let’s say you pay for the arcade game and just reach up into the machine to retrieve a prize. Is there a law against that?,NoStupidQuestions,Is it illegal to take an item from an arcade claw machine if you paid for a game?
TheFlying,cadhn9,,NoStupidQuestions,"If you stand on the opposite side of wind farm from the direction the wind is blowing, is the wind less windy?"
Andy2802,cadoov,"Theoretically, could we make a city ""run out of water"" temporarily?",NoStupidQuestions,"If everyone in a city turned on all their water faucets at the same time, would it be enough to notice a significant drop in pressure, or even a total loss of flow?"
blackjesus1234532,cadrry,"Low levels or high levels, which ever one you have an answer to, thanks.",NoStupidQuestions,What causes someone to have low (or high) levels of dopamine in the body?
Latter_Option,cadqa0,,NoStupidQuestions,Why do we let kids play football when we know it causes permanent brain damage?
CarbonDemontizide,cadvj9,,NoStupidQuestions,What are the scaley painful stuff in swimming trunks for?
pocket-snails,caduuo,I was at the pool with my son yesterday (he is 18 months). As we were playing jumping and splashing he started to run away. We were only in about a foot of water. As he was running towards the edge of the pool he tripped and landed on the hard concrete edge and got a cut under his nose. Minimal amount of blood so he ended up being okay after a few minutes. But it made me wonder why there isn't something there to prevent this type of thing from happening. I've seen many children come close to this happening to them too.,NoStupidQuestions,Why is there no padding on the concrete edge of swimming pools?
ElonsMusk6969,cadtix,"Why on Earth are they so many different swimming strokes?  Freestyle is the fastest and it's not even close! It would be like if there was a 100 meter dash, then a 100 meter skip, than a 100 meter backwards dash than a 100 meter crawl like seriously wtf.",NoStupidQuestions,Why are there different strokes in competitive swimming?
_manik,cadxho,,NoStupidQuestions,"If a 100kg naked man were to fart in space, how much thrust would he produce? And what would be his instantaneous change in velocity?"
KingdomCrown,caduc7,"Whenever the subject of climate change comes up redditors invariably will say that Canada will become warm and sunny or that everyone is going to have to move to canada. I've even seen Canadians saying that Canada is going to get loads of new farmland, massive population growth, and turn into a global superpower. This doesn't sound right to me but I don't know, I admit I only have a very rudimentary understanding of the effects climate change would have. So *would* climate change really make Canada into a temperate region with good farmland?",NoStupidQuestions,What effect will climate change actually have on canada?
tealface00,cadg08,"I havent had an appetit for anything else other than fast food lately, so ive been playing a lot of basketball and drinking about half a gallon of water a day. Does that cancel out all the fast foot i eat? I eat healthy snacks like fruit and stuff too.",NoStupidQuestions,Can exercise and drinking lots of water balance out high sodium?
RapidSafe,cae16k,"I am an adult Male with only passing interest in sports.  I have a couple of teams I support but I don't even follow them very closely. I've often enjoyed the championship and finals games of various sports, but I want to follow along during the seasons. 

What I would like is to be able to join in conversations about whatever is going on.  Where do I learn all the team stories and get a brief on all the players? Heck, even a rundown on more subtle rules and positions that I'm not aware of. Where to start?",NoStupidQuestions,How do I get into sports?
throwawaysamot,cae2k5,,NoStupidQuestions,I made out with a girl yesterday and now I don't feel the need to jerk off. Is this normal?
ravenigma,cae6ys,,NoStupidQuestions,"Why are AI voice assistants usually always female? (ex: Siri, Alexa, Bixby)"
deanoplex,cae0fh,,NoStupidQuestions,[Serious] A loved one who I am caring for is going to die soon. Who do I call when this happens? I am sure that it is not 911. (kicked off of r/askreddit for asking this one)
beta_male24,caeap0,,NoStupidQuestions,How do people with no arms wipe their ass?
M0RTY_C-137,caedpm,"I’ve always wondered this, for pc and Xbox: if you look at a download or update it shows you a fluctuating speed from 200-220mb/s but take the stop watch out and a minutes worth of download is only 1.4 gigs... this 26gig download should only really take 118 seconds... but instead it’s really taking 17 minutes at 25mb/s. 

I’ve always noticed this with pc and other platforms, why is this and what is the 220 mb/s referring to if not the actual speed you’re downloading at?",NoStupidQuestions,"Download meter shows 220mb/s on a download but if you time the download speed it’s only 1,400 megabytes per minute..."
Not_Reverse_Flash_,caegbt,Is there a job application? An election? Does it just depend on knowing the board of trustees? What’s the typical career path?,NoStupidQuestions,How does one become the president of a university?
jbrow058,caekbe,They have hundreds of cargo for no reason and i have to sit at the railroad for ten minutes!,NoStupidQuestions,Why the fuck are trains so long??
skineechef,caem5g,,NoStupidQuestions,Can you Punch a website in the mouth?
Laprasnomore,caekwx,"I've seem ads for them as well as dozens on the app store, so clearly they're making some kind of profit. My mother also plays some, but from what I can see, it's just numbers going up and down on a screen, with no further input aside from how much to bet and when to make the machine spin.

Other mobile games at least have some kind of skill or gameplay, even if those can be shallow too. I just don't understand the appeal. Can someone clarify?",NoStupidQuestions,What's the appeal of those slot machine mobile games?
devotion1,caemul,,NoStupidQuestions,"I am an American. What are foreign war movies like that depict the United States? We have things like Saving Private Ryan, Platoon, The Hurt Locker, and etc. What are the opposing views in other countries like? Examples?"
JJ_Blocks,caerac,"I stayed up all night yesterday pondering this question, I still have not come to a conclusion and it is driving me insane. I can not longer function as a functioning member of society until I get an answer, please, help.",NoStupidQuestions,"If Mike Wazowski (Monsters Inc) Lost His Legs, Would He Legless, or Decapitated."
Com_Trad_IsTime,caetsn,I’m 5ft 10 and I like long socks but they never fit. Knee length is always mid caff. Thigh high is always awkward cause it like just covers half my knee. Is there a place that sells LONG socks?? My feet are a size 8.5 if that changes anything. I just find long socks for normal height girls online.,NoStupidQuestions,Are there thigh high socks for tall girls?
hamtaro3,caeslu,,NoStupidQuestions,What foods will cause you to be more attractive to mosquitoes?
wumbo52252,caexiz,"I've been around plenty of guys who smelled bad, but never a girl which leads me to believe that that they may be unable to.",NoStupidQuestions,Can girls even smell bad?
ImmaFancyBoy,caex51,Not trying to start a political debate. Genuinely curious. Do we send them to their countries consulate? Do we find their legal guardian somehow? Do they go into American foster care?,NoStupidQuestions,What happens to children at the border if it's determined the adult escorting them is not a relative?
flarn2006,cafwsv,"They're more convenient than stairs, cheaper than elevators and escalators, and faster than all three. And on top of that, they're fun. They're only one way and not wheelchair accessible, but then again so are escalators. (And stairs aren't wheelchair-accessible either.) Would there be any downside to replacing downward escalators with slides everywhere?",NoStupidQuestions,Why don't we use slides (like on the playground) as a serious means of vertical transportation in buildings?
bunnylove5811,cak1f7,,NoStupidQuestions,"Is there a sub for memes made by people 30 or older? Not knocking anybody I just like funny memes but the majority I see on reddit are geared towards teenagers I guess. Not here to start an argument, just looking for old man humor."
Redmasssster,cagbg7,"When you do the meme capitalization, are you supposed to capitalize certain sounds like vowels only? Are you supposed to do every other letter? Whatever's aesthetically pleasing? This isn't important at all but pls answer my question.",NoStupidQuestions,Is tHeRe a mEThOd tO tyPiNg LIke ThIs?
denkmemz,cafh1t,,NoStupidQuestions,Why is the symbol for dollars ($) an S with a line vertically through it?
